index,name,ui_name,description,damage_array,attack_range_array,attack_delay_array,building_type,cost,upgrad_cost,resell_cost_percent,max_level,usable_bullet_name
1001,SmallTankA,기관포탑,가장 기본적인 기관포탑 입니다.,7 10,3 4.5,1 0.75,MachineGun,150,250,0.6,2,BulletA
1002,SmallTankB,로켓포탑,가장 기본적인 로켓포탑 입니다.,12 15,5 6.5,3 2,Cannon,250,300,0.6,2,CannonA
1003,SmallTankC,개량형 기관포탑,기관포탑을 개량해 전체적인 성능을 향상시킨 기관포탑 입니다.,9 13,2 3,0.8 0.6,MachineGun,300,250,0.6,2,BulletB
1004,MediumTankA,개량형 로켓포탑,로켓포탑을 개량한 결과물로 기존 로켓포탑보다 비거리와 데미지가 증가한 로켓포탑 입니다.,14 2,3.5 4.5,2 1,Cannon,350,300,0.6,2,CannonB
1005,MediumTankB,고성능 기관포탑,현존하는 기관포탑 중 가장 강력한 성능을 가진 기관포탑 입니다.,13 17,4 5,0.5 0.2,MachineGun,400,350,0.6,2,BulletC
1006,MediumTankC,고성능 로켓포탑,포탄 한 발로 세상을 평정해주지.,18 25,4.5 6,1.5 0.5,Cannon,450,500,0.6,2,CannonC